<?xml version="1.0"?>
<?xml-stylesheet type="text/xsl" href="pdml2html.xsl"?>
<!-- You can find pdml2html.xsl in /usr/share/wireshark or at https://code.wireshark.org/review/gitweb?p=wireshark.git;a=blob_plain;f=pdml2html.xsl. -->
<!-- Examples in this file are taken from a packet capture of make test -->
<!-- where values where too large and of no interest they where  replaced with "...elided..." -->
<pdml version="0" creator="wireshark/2.0.2" time="Wed Feb 15 14:51:04 2017" capture_file="sample.pcap">

<packet>
  <proto name="geninfo" pos="0" showname="General information" size="78">
    <field name="num" pos="0" show="1" showname="Number" value="1" size="78"/>
    <field name="len" pos="0" show="78" showname="Frame Length" value="4e" size="78"/>
    <field name="caplen" pos="0" show="78" showname="Captured Length" value="4e" size="78"/>
    <field name="timestamp" pos="0" show="Feb 10, 2017 14:36:16.530451000 NZDT" showname="Captured Time" value="1486690576.530451000" size="78"/>
  </proto>
  <proto name="frame" showname="Frame 1: 78 bytes on wire (624 bits), 78 bytes captured (624 bits)" size="78" pos="0">
    <field name="frame.encap_type" showname="Encapsulation type: Raw IP (7)" size="0" pos="0" show="7"/>
    <field name="frame.time" showname="Arrival Time: Feb 10, 2017 14:36:16.530451000 NZDT" size="0" pos="0" show="Feb 10, 2017 14:36:16.530451000 NZDT"/>
    <field name="frame.offset_shift" showname="Time shift for this packet: 0.000000000 seconds" size="0" pos="0" show="0.000000000"/>
    <field name="frame.time_epoch" showname="Epoch Time: 1486690576.530451000 seconds" size="0" pos="0" show="1486690576.530451000"/>
    <field name="frame.time_delta" showname="Time delta from previous captured frame: 0.000000000 seconds" size="0" pos="0" show="0.000000000"/>
    <field name="frame.time_delta_displayed" showname="Time delta from previous displayed frame: 0.000000000 seconds" size="0" pos="0" show="0.000000000"/>
    <field name="frame.time_relative" showname="Time since reference or first frame: 0.000000000 seconds" size="0" pos="0" show="0.000000000"/>
    <field name="frame.number" showname="Frame Number: 1" size="0" pos="0" show="1"/>
    <field name="frame.len" showname="Frame Length: 78 bytes (624 bits)" size="0" pos="0" show="78"/>
    <field name="frame.cap_len" showname="Capture Length: 78 bytes (624 bits)" size="0" pos="0" show="78"/>
    <field name="frame.marked" showname="Frame is marked: False" size="0" pos="0" show="0"/>
    <field name="frame.ignored" showname="Frame is ignored: False" size="0" pos="0" show="0"/>
    <field name="frame.protocols" showname="Protocols in frame: raw:ip:udp:nbns" size="0" pos="0" show="raw:ip:udp:nbns"/>
  </proto>
  <proto name="raw" showname="Raw packet data" size="78" pos="0"/>
  <proto name="ip" showname="Internet Protocol Version 4, Src: 127.0.0.1, Dst: 127.255.255.255" size="20" pos="0">
    <field name="ip.version" showname="0100 .... = Version: 4" size="1" pos="0" show="4" value="4" unmaskedvalue="45"/>
    <field name="ip.hdr_len" showname=".... 0101 = Header Length: 20 bytes" size="1" pos="0" show="5" value="5" unmaskedvalue="45"/>
    <field name="ip.dsfield" showname="Differentiated Services Field: 0x00 (DSCP: CS0, ECN: Not-ECT)" size="1" pos="1" show="0x00000000" value="00">
      <field name="ip.dsfield.dscp" showname="0000 00.. = Differentiated Services Codepoint: Default (0)" size="1" pos="1" show="0" value="0" unmaskedvalue="00"/>
      <field name="ip.dsfield.ecn" showname=".... ..00 = Explicit Congestion Notification: Not ECN-Capable Transport (0)" size="1" pos="1" show="0" value="0" unmaskedvalue="00"/>
    </field>
    <field name="ip.len" showname="Total Length: 78" size="2" pos="2" show="78" value="004e"/>
    <field name="ip.id" showname="Identification: 0xffff (65535)" size="2" pos="4" show="0x0000ffff" value="ffff"/>
    <field name="ip.flags" showname="Flags: 0x02 (Don&#x27;t Fragment)" size="1" pos="6" show="0x00000002" value="40">
      <field name="ip.flags.rb" showname="0... .... = Reserved bit: Not set" size="1" pos="6" show="0" value="40"/>
      <field name="ip.flags.df" showname=".1.. .... = Don&#x27;t fragment: Set" size="1" pos="6" show="1" value="40"/>
      <field name="ip.flags.mf" showname="..0. .... = More fragments: Not set" size="1" pos="6" show="0" value="40"/>
    </field>
    <field name="ip.frag_offset" showname="Fragment offset: 0" size="2" pos="6" show="0" value="4000"/>
    <field name="ip.ttl" showname="Time to live: 255" size="1" pos="8" show="255" value="ff"/>
    <field name="ip.proto" showname="Protocol: UDP (17)" size="1" pos="9" show="17" value="11"/>
    <field name="ip.checksum" showname="Header checksum: 0x0000 [validation disabled]" size="2" pos="10" show="0x00000000" value="0000">
      <field name="ip.checksum_good" showname="Good: False" size="2" pos="10" show="0" value="0000"/>
      <field name="ip.checksum_bad" showname="Bad: False" size="2" pos="10" show="0" value="0000"/>
    </field>
   <field name="ip.src" showname="Source: 127.0.0.1" size="4" pos="12" show="127.0.0.1" value="7f000001"/>
    <field name="ip.addr" showname="Source or Destination Address: 127.0.0.1" hide="yes" size="4" pos="12" show="127.0.0.1" value="7f000001"/>
    <field name="ip.src_host" showname="Source Host: 127.0.0.1" hide="yes" size="4" pos="12" show="127.0.0.1" value="7f000001"/>
    <field name="ip.host" showname="Source or Destination Host: 127.0.0.1" hide="yes" size="4" pos="12" show="127.0.0.1" value="7f000001"/>
    <field name="ip.dst" showname="Destination: 127.255.255.255" size="4" pos="16" show="127.255.255.255" value="7fffffff"/>
    <field name="ip.addr" showname="Source or Destination Address: 127.255.255.255" hide="yes" size="4" pos="16" show="127.255.255.255" value="7fffffff"/>
    <field name="ip.dst_host" showname="Destination Host: 127.255.255.255" hide="yes" size="4" pos="16" show="127.255.255.255" value="7fffffff"/>
    <field name="ip.host" showname="Source or Destination Host: 127.255.255.255" hide="yes" size="4" pos="16" show="127.255.255.255" value="7fffffff"/>
    <field name="" show="Source GeoIP: Unknown" size="4" pos="12" value="7f000001"/>
    <field name="" show="Destination GeoIP: Unknown" size="4" pos="16" value="7fffffff"/>
  </proto>
  <proto name="udp" showname="User Datagram Protocol, Src Port: 14705 (14705), Dst Port: 137 (137)" size="8" pos="20">
    <field name="udp.srcport" showname="Source Port: 14705" size="2" pos="20" show="14705" value="3971"/>
    <field name="udp.dstport" showname="Destination Port: 137" size="2" pos="22" show="137" value="0089"/>
    <field name="udp.port" showname="Source or Destination Port: 14705" hide="yes" size="2" pos="20" show="14705" value="3971"/>
    <field name="udp.port" showname="Source or Destination Port: 137" hide="yes" size="2" pos="22" show="137" value="0089"/>
    <field name="udp.length" showname="Length: 58" size="2" pos="24" show="58" value="003a"/>
    <field name="udp.checksum" showname="Checksum: 0x0000 (none)" size="2" pos="26" show="0x00000000" value="0000">
      <field name="udp.checksum_good" showname="Good Checksum: False" size="2" pos="26" show="0" value="0000"/>
      <field name="udp.checksum_bad" showname="Bad Checksum: False" size="2" pos="26" show="0" value="0000"/>
    </field>
    <field name="udp.stream" showname="Stream index: 0" size="0" pos="28" show="0"/>
  </proto>
  <proto name="nbns" showname="NetBIOS Name Service" size="50" pos="28">
    <field name="nbns.id" showname="Transaction ID: 0x29d6" size="2" pos="28" show="0x000029d6" value="29d6"/>
    <field name="nbns.flags" showname="Flags: 0x0010, Opcode: Name query, Broadcast" size="2" pos="30" show="0x00000010" value="0010">
      <field name="nbns.flags.response" showname="0... .... .... .... = Response: Message is a query" size="2" pos="30" show="0" value="0" unmaskedvalue="0010"/>
      <field name="nbns.flags.opcode" showname=".000 0... .... .... = Opcode: Name query (0)" size="2" pos="30" show="0" value="0" unmaskedvalue="0010"/>
      <field name="nbns.flags.truncated" showname=".... ..0. .... .... = Truncated: Message is not truncated" size="2" pos="30" show="0" value="0" unmaskedvalue="0010"/>
      <field name="nbns.flags.recdesired" showname=".... ...0 .... .... = Recursion desired: Don&#x27;t do query recursively" size="2" pos="30" show="0" value="0" unmaskedvalue="0010"/>
      <field name="nbns.flags.broadcast" showname=".... .... ...1 .... = Broadcast: Broadcast packet" size="2" pos="30" show="1" value="FFFFFFFF" unmaskedvalue="0010"/>
    </field>
    <field name="nbns.count.queries" showname="Questions: 1" size="2" pos="32" show="1" value="0001"/>
    <field name="nbns.count.answers" showname="Answer RRs: 0" size="2" pos="34" show="0" value="0000"/>
    <field name="nbns.count.auth_rr" showname="Authority RRs: 0" size="2" pos="36" show="0" value="0000"/>
    <field name="nbns.count.add_rr" showname="Additional RRs: 0" size="2" pos="38" show="0" value="0000"/>
    <field name="" show="Queries" size="38" pos="40" value="20454d455045444542454d454545444341434143414341434143414341434141410000200001">
      <field name="" show="LOCALDC&lt;00&gt;: type NB, class IN" size="38" pos="40" value="20454d455045444542454d454545444341434143414341434143414341434141410000200001">
        <field name="nbns.name" showname="Name: LOCALDC&lt;00&gt; (Workstation/Redirector)" size="34" pos="40" show="LOCALDC&lt;00&gt;" value="20454d455045444542454d4545454443414341434143414341434143414341414100"/>
        <field name="nbns.type" showname="Type: NB (32)" size="2" pos="74" show="32" value="0020"/>
        <field name="nbns.class" showname="Class: IN (1)" size="2" pos="76" show="1" value="0001"/>
      </field>
    </field>
  </proto>
</packet>

<packet>
  <proto name="geninfo" pos="0" showname="General information" size="296">
    <field name="num" pos="0" show="47" showname="Number" value="2f" size="296"/>
    <field name="len" pos="0" show="296" showname="Frame Length" value="128" size="296"/>
    <field name="caplen" pos="0" show="296" showname="Captured Length" value="128" size="296"/>
    <field name="timestamp" pos="0" show="Feb 10, 2017 14:36:18.137335000 NZDT" showname="Captured Time" value="1486690578.137335000" size="296"/>
  </proto>
  <proto name="frame" showname="Frame 47: 296 bytes on wire (2368 bits), 296 bytes captured (2368 bits)" size="296" pos="0">
    <field name="frame.encap_type" showname="Encapsulation type: Raw IP (7)" size="0" pos="0" show="7"/>
    <field name="frame.time" showname="Arrival Time: Feb 10, 2017 14:36:18.137335000 NZDT" size="0" pos="0" show="Feb 10, 2017 14:36:18.137335000 NZDT"/>
    <field name="frame.offset_shift" showname="Time shift for this packet: 0.000000000 seconds" size="0" pos="0" show="0.000000000"/>
    <field name="frame.time_epoch" showname="Epoch Time: 1486690578.137335000 seconds" size="0" pos="0" show="1486690578.137335000"/>
    <field name="frame.time_delta" showname="Time delta from previous captured frame: 0.000016000 seconds" size="0" pos="0" show="0.000016000"/>
    <field name="frame.time_delta_displayed" showname="Time delta from previous displayed frame: 0.000016000 seconds" size="0" pos="0" show="0.000016000"/>
    <field name="frame.time_relative" showname="Time since reference or first frame: 1.606884000 seconds" size="0" pos="0" show="1.606884000"/>
    <field name="frame.number" showname="Frame Number: 47" size="0" pos="0" show="47"/>
    <field name="frame.len" showname="Frame Length: 296 bytes (2368 bits)" size="0" pos="0" show="296"/>
    <field name="frame.cap_len" showname="Capture Length: 296 bytes (2368 bits)" size="0" pos="0" show="296"/>
    <field name="frame.marked" showname="Frame is marked: False" size="0" pos="0" show="0"/>
    <field name="frame.ignored" showname="Frame is ignored: False" size="0" pos="0" show="0"/>
    <field name="frame.protocols" showname="Protocols in frame: raw:ip:tcp:kerberos" size="0" pos="0" show="raw:ip:tcp:kerberos"/>
  </proto>
  <proto name="raw" showname="Raw packet data" size="296" pos="0"/>
  <proto name="ip" showname="Internet Protocol Version 4, Src: 127.0.0.21, Dst: 127.0.0.21" size="20" pos="0">
    <field name="ip.version" showname="0100 .... = Version: 4" size="1" pos="0" show="4" value="4" unmaskedvalue="45"/>
    <field name="ip.hdr_len" showname=".... 0101 = Header Length: 20 bytes" size="1" pos="0" show="5" value="5" unmaskedvalue="45"/>
    <field name="ip.dsfield" showname="Differentiated Services Field: 0x00 (DSCP: CS0, ECN: Not-ECT)" size="1" pos="1" show="0x00000000" value="00">
      <field name="ip.dsfield.dscp" showname="0000 00.. = Differentiated Services Codepoint: Default (0)" size="1" pos="1" show="0" value="0" unmaskedvalue="00"/>
      <field name="ip.dsfield.ecn" showname=".... ..00 = Explicit Congestion Notification: Not ECN-Capable Transport (0)" size="1" pos="1" show="0" value="0" unmaskedvalue="00"/>
    </field>
    <field name="ip.len" showname="Total Length: 296" size="2" pos="2" show="296" value="0128"/>
    <field name="ip.id" showname="Identification: 0xffff (65535)" size="2" pos="4" show="0x0000ffff" value="ffff"/>
    <field name="ip.flags" showname="Flags: 0x02 (Don&#x27;t Fragment)" size="1" pos="6" show="0x00000002" value="40">
      <field name="ip.flags.rb" showname="0... .... = Reserved bit: Not set" size="1" pos="6" show="0" value="40"/>
      <field name="ip.flags.df" showname=".1.. .... = Don&#x27;t fragment: Set" size="1" pos="6" show="1" value="40"/>
      <field name="ip.flags.mf" showname="..0. .... = More fragments: Not set" size="1" pos="6" show="0" value="40"/>
    </field>
    <field name="ip.frag_offset" showname="Fragment offset: 0" size="2" pos="6" show="0" value="4000"/>
    <field name="ip.ttl" showname="Time to live: 255" size="1" pos="8" show="255" value="ff"/>
    <field name="ip.proto" showname="Protocol: TCP (6)" size="1" pos="9" show="6" value="06"/>
    <field name="ip.checksum" showname="Header checksum: 0x0000 [validation disabled]" size="2" pos="10" show="0x00000000" value="0000">
      <field name="ip.checksum_good" showname="Good: False" size="2" pos="10" show="0" value="0000"/>
      <field name="ip.checksum_bad" showname="Bad: False" size="2" pos="10" show="0" value="0000"/>
    </field>
    <field name="ip.src" showname="Source: 127.0.0.21" size="4" pos="12" show="127.0.0.21" value="7f000015"/>
    <field name="ip.addr" showname="Source or Destination Address: 127.0.0.21" hide="yes" size="4" pos="12" show="127.0.0.21" value="7f000015"/>
    <field name="ip.src_host" showname="Source Host: 127.0.0.21" hide="yes" size="4" pos="12" show="127.0.0.21" value="7f000015"/>
    <field name="ip.host" showname="Source or Destination Host: 127.0.0.21" hide="yes" size="4" pos="12" show="127.0.0.21" value="7f000015"/>
    <field name="ip.dst" showname="Destination: 127.0.0.21" size="4" pos="16" show="127.0.0.21" value="7f000015"/>
    <field name="ip.addr" showname="Source or Destination Address: 127.0.0.21" hide="yes" size="4" pos="16" show="127.0.0.21" value="7f000015"/>
    <field name="ip.dst_host" showname="Destination Host: 127.0.0.21" hide="yes" size="4" pos="16" show="127.0.0.21" value="7f000015"/>
    <field name="ip.host" showname="Source or Destination Host: 127.0.0.21" hide="yes" size="4" pos="16" show="127.0.0.21" value="7f000015"/>
    <field name="" show="Source GeoIP: Unknown" size="4" pos="12" value="7f000015"/>
    <field name="" show="Destination GeoIP: Unknown" size="4" pos="16" value="7f000015"/>
  </proto>
  <proto name="tcp" showname="Transmission Control Protocol, Src Port: 14723 (14723), Dst Port: 88 (88), Seq: 1, Ack: 1, Len: 256" size="20" pos="20">
    <field name="tcp.srcport" showname="Source Port: 14723" size="2" pos="20" show="14723" value="3983"/>
    <field name="tcp.dstport" showname="Destination Port: 88" size="2" pos="22" show="88" value="0058"/>
    <field name="tcp.port" showname="Source or Destination Port: 14723" hide="yes" size="2" pos="20" show="14723" value="3983"/>
    <field name="tcp.port" showname="Source or Destination Port: 88" hide="yes" size="2" pos="22" show="88" value="0058"/>
    <field name="tcp.stream" showname="Stream index: 0" size="0" pos="20" show="0"/>
    <field name="tcp.len" showname="TCP Segment Len: 256" size="1" pos="32" show="256" value="50"/>
    <field name="tcp.seq" showname="Sequence number: 1    (relative sequence number)" size="4" pos="24" show="1" value="00000001"/>
    <field name="tcp.nxtseq" showname="Next sequence number: 257    (relative sequence number)" size="0" pos="20" show="257"/>
    <field name="tcp.ack" showname="Acknowledgment number: 1    (relative ack number)" size="4" pos="28" show="1" value="00000001"/>
    <field name="tcp.hdr_len" showname="Header Length: 20 bytes" size="1" pos="32" show="20" value="50"/>
    <field name="tcp.flags" showname="Flags: 0x018 (PSH, ACK)" size="2" pos="32" show="0x00000018" value="18" unmaskedvalue="5018">
      <field name="tcp.flags.res" showname="000. .... .... = Reserved: Not set" size="1" pos="32" show="0" value="0" unmaskedvalue="50"/>
      <field name="tcp.flags.ns" showname="...0 .... .... = Nonce: Not set" size="1" pos="32" show="0" value="0" unmaskedvalue="50"/>
      <field name="tcp.flags.cwr" showname=".... 0... .... = Congestion Window Reduced (CWR): Not set" size="1" pos="33" show="0" value="0" unmaskedvalue="18"/>
      <field name="tcp.flags.ecn" showname=".... .0.. .... = ECN-Echo: Not set" size="1" pos="33" show="0" value="0" unmaskedvalue="18"/>
      <field name="tcp.flags.urg" showname=".... ..0. .... = Urgent: Not set" size="1" pos="33" show="0" value="0" unmaskedvalue="18"/>
      <field name="tcp.flags.ack" showname=".... ...1 .... = Acknowledgment: Set" size="1" pos="33" show="1" value="FFFFFFFF" unmaskedvalue="18"/>
      <field name="tcp.flags.push" showname=".... .... 1... = Push: Set" size="1" pos="33" show="1" value="FFFFFFFF" unmaskedvalue="18"/>
      <field name="tcp.flags.reset" showname=".... .... .0.. = Reset: Not set" size="1" pos="33" show="0" value="0" unmaskedvalue="18"/>
      <field name="tcp.flags.syn" showname=".... .... ..0. = Syn: Not set" size="1" pos="33" show="0" value="0" unmaskedvalue="18"/>
      <field name="tcp.flags.fin" showname=".... .... ...0 = Fin: Not set" size="1" pos="33" show="0" value="0" unmaskedvalue="18"/>
      <field name="tcp.flags.str" showname="TCP Flags: *******AP***" size="2" pos="32" show="*******AP***" value="5018"/>
    </field>
    <field name="tcp.window_size_value" showname="Window size value: 32767" size="2" pos="34" show="32767" value="7fff"/>
    <field name="tcp.window_size" showname="Calculated window size: 32767" size="2" pos="34" show="32767" value="7fff"/>
    <field name="tcp.window_size_scalefactor" showname="Window size scaling factor: -2 (no window scaling used)" size="2" pos="34" show="-2" value="7fff"/>
    <field name="tcp.checksum" showname="Checksum: 0x0000 [validation disabled]" size="2" pos="36" show="0x00000000" value="0000">
      <field name="tcp.checksum_good" showname="Good Checksum: False" size="2" pos="36" show="0" value="0000"/>
      <field name="tcp.checksum_bad" showname="Bad Checksum: False" size="2" pos="36" show="0" value="0000"/>
    </field>
    <field name="tcp.urgent_pointer" showname="Urgent pointer: 0" size="2" pos="38" show="0" value="0000"/>
    <field name="tcp.analysis" showname="SEQ/ACK analysis" size="0" pos="20" show="" value="">
      <field name="tcp.analysis.initial_rtt" showname="iRTT: 0.000012000 seconds" size="0" pos="20" show="0.000012000"/>
      <field name="tcp.analysis.bytes_in_flight" showname="Bytes in flight: 256" size="0" pos="20" show="256"/>
    </field>
    <field name="tcp.pdu.size" showname="PDU Size: 256" size="256" pos="40" show="256" value="000000fc6a81f93081f6a103020105a20302010aa350304e304ca103020102a24504433041a003020112a23a0438cecfe4905d9670c770a992a4645a9c477b639cfafad21ba2e12cc397eb617687733caf785f07d6f23cf87adc9a1fc5cb1b3ca7e6d17cc86fa48197308194a00703050000000000a1153013a003020101a10c300a1b084c4f43414c444324a2131b1153414d42412e4558414d504c452e434f4da3263024a003020102a11d301b1b066b72627467741b1153414d42412e4558414d504c452e434f4da511180f32303137303231313031333631375aa70602043e9a5c0ea81a3018020112020111020110020105020117020103020102020101"/>
  </proto>
  <proto name="kerberos" showname="Kerberos" size="256" pos="40">
    <field name="" show="Record Mark: 252 bytes" size="4" pos="40" value="000000fc">
      <field name="kerberos.rm.reserved" showname="0... .... .... .... .... .... .... .... = Reserved: Not set" size="4" pos="40" show="0" value="0" unmaskedvalue="000000fc"/>
      <field name="kerberos.rm.length" showname=".000 0000 0000 0000 0000 0000 1111 1100 = Record Length: 252" size="4" pos="40" show="252" value="FC" unmaskedvalue="000000fc"/>
    </field>
    <field name="kerberos.as_req_element" showname="as-req" size="249" pos="47" show="" value="">
      <field name="kerberos.pvno" showname="pvno: 5" size="1" pos="54" show="5" value="05"/>
      <field name="kerberos.msg_type" showname="msg-type: krb-as-req (10)" size="1" pos="59" show="10" value="0a"/>
      <field name="kerberos.padata" showname="padata: 1 item" size="78" pos="64" show="1" value="304ca103020102a24504433041a003020112a23a0438cecfe4905d9670c770a992a4645a9c477b639cfafad21ba2e12cc397eb617687733caf785f07d6f23cf87adc9a1fc5cb1b3ca7e6d17cc86f">
        <field name="kerberos.PA_DATA_element" showname="PA-DATA PA-ENC-TIMESTAMP" size="78" pos="64" show="" value="">
          <field name="kerberos.padata_type" showname="padata-type: kRB5-PADATA-ENC-TIMESTAMP (2)" size="1" pos="70" show="2" value="02">
            <field name="kerberos.padata_value" showname="padata-value: 3041a003020112a23a0438cecfe4905d9670c770a992a464..." size="67" pos="75" show="30:41:a0:03:02:01:12:a2:3a:04:38:ce:cf:e4:90:5d:96:70:c7:70:a9:92:a4:64:5a:9c:47:7b:63:9c:fa:fa:d2:1b:a2:e1:2c:c3:97:eb:61:76:87:73:3c:af:78:5f:07:d6:f2:3c:f8:7a:dc:9a:1f:c5:cb:1b:3c:a7:e6:d1:7c:c8:6f" value="3041a003020112a23a0438cecfe4905d9670c770a992a4645a9c477b639cfafad21ba2e12cc397eb617687733caf785f07d6f23cf87adc9a1fc5cb1b3ca7e6d17cc86f">
              <field name="kerberos.etype" showname="etype: eTYPE-AES256-CTS-HMAC-SHA1-96 (18)" size="1" pos="81" show="18" value="12"/>
              <field name="kerberos.cipher" showname="cipher: cecfe4905d9670c770a992a4645a9c477b639cfafad21ba2..." size="56" pos="86" show="ce:cf:e4:90:5d:96:70:c7:70:a9:92:a4:64:5a:9c:47:7b:63:9c:fa:fa:d2:1b:a2:e1:2c:c3:97:eb:61:76:87:73:3c:af:78:5f:07:d6:f2:3c:f8:7a:dc:9a:1f:c5:cb:1b:3c:a7:e6:d1:7c:c8:6f" value="cecfe4905d9670c770a992a4645a9c477b639cfafad21ba2e12cc397eb617687733caf785f07d6f23cf87adc9a1fc5cb1b3ca7e6d17cc86f"/>
            </field>
          </field>
        </field>
      </field>
      <field name="kerberos.req_body_element" showname="req-body" size="151" pos="145" show="" value="">
        <field name="ber.bitstring.padding" showname="Padding: 0" size="1" pos="152" show="0" value="00"/>
        <field name="kerberos.kdc_options" showname="kdc-options: 00000000" size="4" pos="153" show="00:00:00:00" value="00000000">
          <field name="kerberos.reserved" showname="0... .... = reserved: False" size="1" pos="153" show="0" value="0" unmaskedvalue="00"/>
          <field name="kerberos.forwardable" showname=".0.. .... = forwardable: False" size="1" pos="153" show="0" value="0" unmaskedvalue="00"/>
          <field name="kerberos.forwarded" showname="..0. .... = forwarded: False" size="1" pos="153" show="0" value="0" unmaskedvalue="00"/>
          <field name="kerberos.proxiable" showname="...0 .... = proxiable: False" size="1" pos="153" show="0" value="0" unmaskedvalue="00"/>
          <field name="kerberos.proxy" showname=".... 0... = proxy: False" size="1" pos="153" show="0" value="0" unmaskedvalue="00"/>
          <field name="kerberos.allow-postdate" showname=".... .0.. = allow-postdate: False" size="1" pos="153" show="0" value="0" unmaskedvalue="00"/>
          <field name="kerberos.postdated" showname=".... ..0. = postdated: False" size="1" pos="153" show="0" value="0" unmaskedvalue="00"/>
          <field name="kerberos.unused7" showname=".... ...0 = unused7: False" size="1" pos="153" show="0" value="0" unmaskedvalue="00"/>
          <field name="kerberos.renewable" showname="0... .... = renewable: False" size="1" pos="154" show="0" value="0" unmaskedvalue="00"/>
          <field name="kerberos.unused9" showname=".0.. .... = unused9: False" size="1" pos="154" show="0" value="0" unmaskedvalue="00"/>
          <field name="kerberos.unused10" showname="..0. .... = unused10: False" size="1" pos="154" show="0" value="0" unmaskedvalue="00"/>
          <field name="kerberos.opt-hardware-auth" showname="...0 .... = opt-hardware-auth: False" size="1" pos="154" show="0" value="0" unmaskedvalue="00"/>
          <field name="kerberos.request-anonymous" showname=".... ..0. = request-anonymous: False" size="1" pos="154" show="0" value="0" unmaskedvalue="00"/>
          <field name="kerberos.canonicalize" showname=".... ...0 = canonicalize: False" size="1" pos="154" show="0" value="0" unmaskedvalue="00"/>
          <field name="kerberos.constrained-delegation" showname="0... .... = constrained-delegation: False" size="1" pos="155" show="0" value="0" unmaskedvalue="00"/>
          <field name="kerberos.disable-transited-check" showname="..0. .... = disable-transited-check: False" size="1" pos="156" show="0" value="0" unmaskedvalue="00"/>
          <field name="kerberos.renewable-ok" showname="...0 .... = renewable-ok: False" size="1" pos="156" show="0" value="0" unmaskedvalue="00"/>
          <field name="kerberos.enc-tkt-in-skey" showname=".... 0... = enc-tkt-in-skey: False" size="1" pos="156" show="0" value="0" unmaskedvalue="00"/>
          <field name="kerberos.renew" showname=".... ..0. = renew: False" size="1" pos="156" show="0" value="0" unmaskedvalue="00"/>
          <field name="kerberos.validate" showname=".... ...0 = validate: False" size="1" pos="156" show="0" value="0" unmaskedvalue="00"/>
        </field>
        <field name="kerberos.cname_element" showname="cname" size="21" pos="159" show="" value="">
          <field name="kerberos.name_type" showname="name-type: kRB5-NT-PRINCIPAL (1)" size="1" pos="165" show="1" value="01"/>
          <field name="kerberos.name_string" showname="name-string: 1 item" size="10" pos="170" show="1" value="1b084c4f43414c444324">
            <field name="kerberos.KerberosString" showname="KerberosString: LOCALDC$" size="8" pos="172" show="LOCALDC$" value="4c4f43414c444324"/>
          </field>
        </field>
        <field name="kerberos.realm" showname="realm: SAMBA.EXAMPLE.COM" size="17" pos="184" show="SAMBA.EXAMPLE.COM" value="53414d42412e4558414d504c452e434f4d"/>
        <field name="kerberos.sname_element" showname="sname" size="38" pos="203" show="" value="">
          <field name="kerberos.name_type" showname="name-type: kRB5-NT-SRV-INST (2)" size="1" pos="209" show="2" value="02"/>
          <field name="kerberos.name_string" showname="name-string: 2 items" size="27" pos="214" show="2" value="1b066b72627467741b1153414d42412e4558414d504c452e434f4d">
            <field name="kerberos.KerberosString" showname="KerberosString: krbtgt" size="6" pos="216" show="krbtgt" value="6b7262746774"/>
            <field name="kerberos.KerberosString" showname="KerberosString: SAMBA.EXAMPLE.COM" size="17" pos="224" show="SAMBA.EXAMPLE.COM" value="53414d42412e4558414d504c452e434f4d"/>
          </field>
        </field>
        <field name="kerberos.till" showname="till: 2017-02-11 01:36:17 (UTC)" size="15" pos="245" show="2017-02-11 01:36:17 (UTC)" value="32303137303231313031333631375a"/>
        <field name="kerberos.nonce" showname="nonce: 1050303502" size="4" pos="264" show="1050303502" value="3e9a5c0e"/>
        <field name="kerberos.etype" showname="etype: 8 items" size="24" pos="272" show="8" value="020112020111020110020105020117020103020102020101">
          <field name="kerberos.ENCTYPE" showname="ENCTYPE: eTYPE-AES256-CTS-HMAC-SHA1-96 (18)" size="1" pos="274" show="18" value="12"/>
          <field name="kerberos.ENCTYPE" showname="ENCTYPE: eTYPE-AES128-CTS-HMAC-SHA1-96 (17)" size="1" pos="277" show="17" value="11"/>
          <field name="kerberos.ENCTYPE" showname="ENCTYPE: eTYPE-DES3-CBC-SHA1 (16)" size="1" pos="280" show="16" value="10"/>
          <field name="kerberos.ENCTYPE" showname="ENCTYPE: eTYPE-DES3-CBC-MD5 (5)" size="1" pos="283" show="5" value="05"/>
          <field name="kerberos.ENCTYPE" showname="ENCTYPE: eTYPE-ARCFOUR-HMAC-MD5 (23)" size="1" pos="286" show="23" value="17"/>
          <field name="kerberos.ENCTYPE" showname="ENCTYPE: eTYPE-DES-CBC-MD5 (3)" size="1" pos="289" show="3" value="03"/>
          <field name="kerberos.ENCTYPE" showname="ENCTYPE: eTYPE-DES-CBC-MD4 (2)" size="1" pos="292" show="2" value="02"/>
          <field name="kerberos.ENCTYPE" showname="ENCTYPE: eTYPE-DES-CBC-CRC (1)" size="1" pos="295" show="1" value="01"/>
        </field>
      </field>
    </field>
  </proto>
</packet>

<packet>
  <proto name="geninfo" pos="0" showname="General information" size="1527">
    <field name="num" pos="0" show="53" showname="Number" value="35" size="1527"/>
    <field name="len" pos="0" show="1527" showname="Frame Length" value="5f7" size="1527"/>
    <field name="caplen" pos="0" show="1527" showname="Captured Length" value="5f7" size="1527"/>
    <field name="timestamp" pos="0" show="Feb 10, 2017 14:36:18.141276000 NZDT" showname="Captured Time" value="1486690578.141276000" size="1527"/>
  </proto>
  <proto name="frame" showname="Frame 53: 1527 bytes on wire (12216 bits), 1527 bytes captured (12216 bits)" size="1527" pos="0">
    <field name="frame.encap_type" showname="Encapsulation type: Raw IP (7)" size="0" pos="0" show="7"/>
    <field name="frame.time" showname="Arrival Time: Feb 10, 2017 14:36:18.141276000 NZDT" size="0" pos="0" show="Feb 10, 2017 14:36:18.141276000 NZDT"/>
    <field name="frame.offset_shift" showname="Time shift for this packet: 0.000000000 seconds" size="0" pos="0" show="0.000000000"/>
    <field name="frame.time_epoch" showname="Epoch Time: 1486690578.141276000 seconds" size="0" pos="0" show="1486690578.141276000"/>
    <field name="frame.time_delta" showname="Time delta from previous captured frame: 0.003784000 seconds" size="0" pos="0" show="0.003784000"/>
    <field name="frame.time_delta_displayed" showname="Time delta from previous displayed frame: 0.003784000 seconds" size="0" pos="0" show="0.003784000"/>
    <field name="frame.time_relative" showname="Time since reference or first frame: 1.610825000 seconds" size="0" pos="0" show="1.610825000"/>
    <field name="frame.number" showname="Frame Number: 53" size="0" pos="0" show="53"/>
    <field name="frame.len" showname="Frame Length: 1527 bytes (12216 bits)" size="0" pos="0" show="1527"/>
    <field name="frame.cap_len" showname="Capture Length: 1527 bytes (12216 bits)" size="0" pos="0" show="1527"/>
    <field name="frame.marked" showname="Frame is marked: False" size="0" pos="0" show="0"/>
    <field name="frame.ignored" showname="Frame is ignored: False" size="0" pos="0" show="0"/>
    <field name="frame.protocols" showname="Protocols in frame: raw:ip:tcp:kerberos" size="0" pos="0" show="raw:ip:tcp:kerberos"/>
  </proto>
  <proto name="raw" showname="Raw packet data" size="1527" pos="0"/>
  <proto name="ip" showname="Internet Protocol Version 4, Src: 127.0.0.21, Dst: 127.0.0.21" size="20" pos="0">
    <field name="ip.version" showname="0100 .... = Version: 4" size="1" pos="0" show="4" value="4" unmaskedvalue="45"/>
    <field name="ip.hdr_len" showname=".... 0101 = Header Length: 20 bytes" size="1" pos="0" show="5" value="5" unmaskedvalue="45"/>
    <field name="ip.dsfield" showname="Differentiated Services Field: 0x00 (DSCP: CS0, ECN: Not-ECT)" size="1" pos="1" show="0x00000000" value="00">
      <field name="ip.dsfield.dscp" showname="0000 00.. = Differentiated Services Codepoint: Default (0)" size="1" pos="1" show="0" value="0" unmaskedvalue="00"/>
      <field name="ip.dsfield.ecn" showname=".... ..00 = Explicit Congestion Notification: Not ECN-Capable Transport (0)" size="1" pos="1" show="0" value="0" unmaskedvalue="00"/>
    </field>
    <field name="ip.len" showname="Total Length: 1527" size="2" pos="2" show="1527" value="05f7"/>
    <field name="ip.id" showname="Identification: 0xffff (65535)" size="2" pos="4" show="0x0000ffff" value="ffff"/>
    <field name="ip.flags" showname="Flags: 0x02 (Don&#x27;t Fragment)" size="1" pos="6" show="0x00000002" value="40">
      <field name="ip.flags.rb" showname="0... .... = Reserved bit: Not set" size="1" pos="6" show="0" value="40"/>
      <field name="ip.flags.df" showname=".1.. .... = Don&#x27;t fragment: Set" size="1" pos="6" show="1" value="40"/>
      <field name="ip.flags.mf" showname="..0. .... = More fragments: Not set" size="1" pos="6" show="0" value="40"/>
    </field>
    <field name="ip.frag_offset" showname="Fragment offset: 0" size="2" pos="6" show="0" value="4000"/>
    <field name="ip.ttl" showname="Time to live: 255" size="1" pos="8" show="255" value="ff"/>
    <field name="ip.proto" showname="Protocol: TCP (6)" size="1" pos="9" show="6" value="06"/>
    <field name="ip.checksum" showname="Header checksum: 0x0000 [validation disabled]" size="2" pos="10" show="0x00000000" value="0000">
      <field name="ip.checksum_good" showname="Good: False" size="2" pos="10" show="0" value="0000"/>
      <field name="ip.checksum_bad" showname="Bad: False" size="2" pos="10" show="0" value="0000"/>
    </field>
    <field name="ip.src" showname="Source: 127.0.0.21" size="4" pos="12" show="127.0.0.21" value="7f000015"/>
    <field name="ip.addr" showname="Source or Destination Address: 127.0.0.21" hide="yes" size="4" pos="12" show="127.0.0.21" value="7f000015"/>
    <field name="ip.src_host" showname="Source Host: 127.0.0.21" hide="yes" size="4" pos="12" show="127.0.0.21" value="7f000015"/>
    <field name="ip.host" showname="Source or Destination Host: 127.0.0.21" hide="yes" size="4" pos="12" show="127.0.0.21" value="7f000015"/>
    <field name="ip.dst" showname="Destination: 127.0.0.21" size="4" pos="16" show="127.0.0.21" value="7f000015"/>
    <field name="ip.addr" showname="Source or Destination Address: 127.0.0.21" hide="yes" size="4" pos="16" show="127.0.0.21" value="7f000015"/>
    <field name="ip.dst_host" showname="Destination Host: 127.0.0.21" hide="yes" size="4" pos="16" show="127.0.0.21" value="7f000015"/>
    <field name="ip.host" showname="Source or Destination Host: 127.0.0.21" hide="yes" size="4" pos="16" show="127.0.0.21" value="7f000015"/>
    <field name="" show="Source GeoIP: Unknown" size="4" pos="12" value="7f000015"/>
    <field name="" show="Destination GeoIP: Unknown" size="4" pos="16" value="7f000015"/>
  </proto>
  <proto name="tcp" showname="Transmission Control Protocol, Src Port: 88 (88), Dst Port: 14723 (14723), Seq: 1, Ack: 257, Len: 1487" size="20" pos="20">
    <field name="tcp.srcport" showname="Source Port: 88" size="2" pos="20" show="88" value="0058"/>
    <field name="tcp.dstport" showname="Destination Port: 14723" size="2" pos="22" show="14723" value="3983"/>
    <field name="tcp.port" showname="Source or Destination Port: 88" hide="yes" size="2" pos="20" show="88" value="0058"/>
    <field name="tcp.port" showname="Source or Destination Port: 14723" hide="yes" size="2" pos="22" show="14723" value="3983"/>
    <field name="tcp.stream" showname="Stream index: 0" size="0" pos="20" show="0"/>
    <field name="tcp.len" showname="TCP Segment Len: 1487" size="1" pos="32" show="1487" value="50"/>
    <field name="tcp.seq" showname="Sequence number: 1    (relative sequence number)" size="4" pos="24" show="1" value="00000001"/>
    <field name="tcp.nxtseq" showname="Next sequence number: 1488    (relative sequence number)" size="0" pos="20" show="1488"/>
    <field name="tcp.ack" showname="Acknowledgment number: 257    (relative ack number)" size="4" pos="28" show="257" value="00000101"/>
    <field name="tcp.hdr_len" showname="Header Length: 20 bytes" size="1" pos="32" show="20" value="50"/>
    <field name="tcp.flags" showname="Flags: 0x018 (PSH, ACK)" size="2" pos="32" show="0x00000018" value="18" unmaskedvalue="5018">
      <field name="tcp.flags.res" showname="000. .... .... = Reserved: Not set" size="1" pos="32" show="0" value="0" unmaskedvalue="50"/>
      <field name="tcp.flags.ns" showname="...0 .... .... = Nonce: Not set" size="1" pos="32" show="0" value="0" unmaskedvalue="50"/>
      <field name="tcp.flags.cwr" showname=".... 0... .... = Congestion Window Reduced (CWR): Not set" size="1" pos="33" show="0" value="0" unmaskedvalue="18"/>
      <field name="tcp.flags.ecn" showname=".... .0.. .... = ECN-Echo: Not set" size="1" pos="33" show="0" value="0" unmaskedvalue="18"/>
      <field name="tcp.flags.urg" showname=".... ..0. .... = Urgent: Not set" size="1" pos="33" show="0" value="0" unmaskedvalue="18"/>
      <field name="tcp.flags.ack" showname=".... ...1 .... = Acknowledgment: Set" size="1" pos="33" show="1" value="FFFFFFFF" unmaskedvalue="18"/>
      <field name="tcp.flags.push" showname=".... .... 1... = Push: Set" size="1" pos="33" show="1" value="FFFFFFFF" unmaskedvalue="18"/>
      <field name="tcp.flags.reset" showname=".... .... .0.. = Reset: Not set" size="1" pos="33" show="0" value="0" unmaskedvalue="18"/>
      <field name="tcp.flags.syn" showname=".... .... ..0. = Syn: Not set" size="1" pos="33" show="0" value="0" unmaskedvalue="18"/>
      <field name="tcp.flags.fin" showname=".... .... ...0 = Fin: Not set" size="1" pos="33" show="0" value="0" unmaskedvalue="18"/>
      <field name="tcp.flags.str" showname="TCP Flags: *******AP***" size="2" pos="32" show="*******AP***" value="5018"/>
    </field>
    <field name="tcp.window_size_value" showname="Window size value: 32767" size="2" pos="34" show="32767" value="7fff"/>
    <field name="tcp.window_size" showname="Calculated window size: 32767" size="2" pos="34" show="32767" value="7fff"/>
    <field name="tcp.window_size_scalefactor" showname="Window size scaling factor: -2 (no window scaling used)" size="2" pos="34" show="-2" value="7fff"/>
    <field name="tcp.checksum" showname="Checksum: 0x0000 [validation disabled]" size="2" pos="36" show="0x00000000" value="0000">
      <field name="tcp.checksum_good" showname="Good Checksum: False" size="2" pos="36" show="0" value="0000"/>
      <field name="tcp.checksum_bad" showname="Bad Checksum: False" size="2" pos="36" show="0" value="0000"/>
    </field>
    <field name="tcp.urgent_pointer" showname="Urgent pointer: 0" size="2" pos="38" show="0" value="0000"/>
    <field name="tcp.analysis" showname="SEQ/ACK analysis" size="0" pos="20" show="" value="">
      <field name="tcp.analysis.acks_frame" showname="This is an ACK to the segment in frame: 47" size="0" pos="20" show="47"/>
      <field name="tcp.analysis.ack_rtt" showname="The RTT to ACK the segment was: 0.003941000 seconds" size="0" pos="20" show="0.003941000"/>
      <field name="tcp.analysis.initial_rtt" showname="iRTT: 0.000012000 seconds" size="0" pos="20" show="0.000012000"/>
      <field name="tcp.analysis.bytes_in_flight" showname="Bytes in flight: 1487" size="0" pos="20" show="1487"/>
    </field>
    <field name="tcp.pdu.size" showname="PDU Size: 1487" size="1487" pos="40" show="1487" value="...elided..."/>
  </proto>
  <proto name="kerberos" showname="Kerberos" size="1487" pos="40">
    <field name="" show="Record Mark: 1483 bytes" size="4" pos="40" value="000005cb">
      <field name="kerberos.rm.reserved" showname="0... .... .... .... .... .... .... .... = Reserved: Not set" size="4" pos="40" show="0" value="0" unmaskedvalue="000005cb"/>
